{
  "name": "Lotus Position on Wheel - 1 Minute",
  "version": "1.0.0",
  "description": "Maintain full lotus position (padmasana) while seated on a balance wheel for a minimum of 60 continuous seconds. The wheel must remain in motion (rocking or rotating) throughout. Demonstrates flexibility, balance, and meditative focus.",
  "category": "balance",
  "difficulty": "advanced",
  "requirements": {
    "duration_seconds": 60,
    "equipment": {
      "type": "balance_wheel",
      "specifications": {
        "wheel_diameter_cm": "35-50",
        "seat_width_cm": "30-40",
        "wheel_type": "single_axis_rocker"
      }
    },
    "position": "full_lotus",
    "restrictions": [
      "no_ground_touch",
      "no_external_support",
      "wheel_must_be_in_motion",
      "full_lotus_maintained"
    ]
  },
  "evidence": {
    "required": ["video"],
    "optional": ["witness", "photo"],
    "video": {
      "min_duration_seconds": 65,
      "must_show": [
        "full_body",
        "lotus_position_clearly_visible",
        "wheel_motion",
        "visible_timer",
        "no_support_contact"
      ],
      "continuous": true,
      "min_resolution": "720p"
    }
  },
  "scoring": {
    "type": "duration",
    "unit": "seconds",
    "min_pass": 60,
    "max_score": 300
  },
  "economics": {
    "base_fee_ec": 75,
    "creator_royalty_bps": 2500
  },
  "safety": {
    "warnings": [
      "Requires existing lotus flexibility",
      "Fall risk - use soft surface underneath",
      "Do not force lotus if hips are tight"
    ],
    "contraindications": [
      "Knee injuries",
      "Hip injuries",
      "Ankle problems",
      "Inability to perform lotus on ground"
    ],
    "recommended_supervision": true
  },
  "metadata": {
    "creator": "Embodied Coherence Genesis",
    "created_at": "2026-01-04T00:00:00Z",
    "tags": ["yoga", "balance", "flexibility", "meditation", "advanced"],
    "related_standards": []
  }
}
